{
  "$schema": "https://json-schema.org/draft/2020-12/schema",
  "$id": "urn:agent-fabric:hosts",
  "title": "The hosts the fabric operates, and where each account lives",
  "description": "runtime/hosts/registry.json. A host id is its short hostname. Placement maps a Linux login to the host it was provisioned on; it is where the account is, never who it is or what role it holds.",
  "type": "object",
  "required": [
    "version",
    "hosts",
    "placement"
  ],
  "additionalProperties": false,
  "properties": {
    "version": {
      "const": 1
    },
    "description": {
      "type": "string"
    },
    "hosts": {
      "type": "object",
      "minProperties": 1,
      "propertyNames": {
        "pattern": "^[a-z0-9]([a-z0-9-]{0,61}[a-z0-9])?$"
      },
      "additionalProperties": {
        "type": "object",
        "required": [
          "platform",
          "ssh",
          "operator",
          "fabric"
        ],
        "additionalProperties": false,
        "properties": {
          "platform": {
            "enum": [
              "fedora-qubes",
              "fedora",
              "debian",
              "debian-qubes"
            ]
          },
          "ssh": {
            "type": [
              "string",
              "null"
            ],
            "pattern": "^[A-Za-z0-9._-]+@[A-Za-z0-9._:\\[\\]-]+$|^[A-Za-z0-9._:\\[\\]-]+$",
            "description": "An ssh destination for the operator account ([user@]host), or null: the host this registry is read on, reached directly."
          },
          "sshd": {
            "type": [
              "object",
              "null"
            ],
            "required": [
              "address",
              "port",
              "host_keys"
            ],
            "additionalProperties": false,
            "description": "The host's own sshd, which the operator's Fleet Deck reaches each placed account through (ADR-048): null or absent until provisioned. Not `ssh`, which is the coordinator's destination for the operator account and null for the local host. `host_keys` are the host's public keys as `<type> <base64>`, read on the host (ssh-operator.sh prints them) and pinned here; `fabric-ssh-hosts known-hosts` writes known_hosts from them and `check` compares them with the host.",
            "properties": {
              "address": {
                "type": "string",
                "pattern": "^(\\d{1,3}\\.){3}\\d{1,3}$|^[0-9A-Fa-f:]+$",
                "description": "An IP address, not a name: a name would be resolved, and the pin would follow whatever it resolved to. 127.0.0.1 on a single-host deployment."
              },
              "port": {
                "type": "integer",
                "minimum": 1,
                "maximum": 65535
              },
              "host_keys": {
                "type": "array",
                "minItems": 1,
                "uniqueItems": true,
                "items": {
                  "type": "string",
                  "pattern": "^(ssh-ed25519|ecdsa-sha2-nistp256|ecdsa-sha2-nistp384|ecdsa-sha2-nistp521|ssh-rsa) AAAA[A-Za-z0-9+/]+={0,2}$"
                }
              }
            }
          },
          "operator": {
            "type": "string",
            "pattern": "^[a-z_][a-z0-9_-]*$",
            "description": "The login on that host that holds sudo and the fabric checkout; the ssh destination logs in as it."
          },
          "fabric": {
            "type": "string",
            "description": "The operator's fabric checkout on that host; ~ is the operator's home there."
          },
          "operator_key": {
            "type": "string",
            "pattern": "^ed25519:[A-Za-z0-9+/]{59}=$",
            "description": "The public half of the operator's control-plane signing key (SPKI DER, base64), written by `fabric-ctl keygen`. Every control daemon answers an ACTION (tools/fabric/control/sign.py) only when it is signed with this key; a host without one can order no action. Optional: read ops need no key. The width is exact — an Ed25519 SPKI is always 44 bytes, 59 base64 characters and one `=` — so a truncated or mispadded key fails lint; a same-width value that is not an SPKI is caught by tests/test_operator_data.py, which parses the committed key as the daemons do."
          },
          "interweave_address": {
            "type": "string",
            "pattern": "^(\\d{1,3}\\.){3}\\d{1,3}$|^[0-9A-Fa-f:]+$",
            "description": "Optional: the literal IP the InterWeave carrier listens on and is reached at for the accounts this host places (ADR-064 rule 1's second-host milestone); an IP, not a name, as for sshd.address. Absent, the host's accounts use 127.0.0.1."
          }
        }
      }
    },
    "placement": {
      "type": "object",
      "propertyNames": {
        "pattern": "^[a-z_][a-z0-9_-]*$"
      },
      "additionalProperties": {
        "type": "string",
        "pattern": "^[a-z0-9]([a-z0-9-]{0,61}[a-z0-9])?$"
      }
    },
    "kinds": {
      "description": "A placed login's kind when it is not an agent (ADR-044): human. A login not named here is an agent.",
      "type": "object",
      "additionalProperties": {
        "enum": [
          "agent",
          "human"
        ]
      }
    }
  }
}
